13:22:25.453747 IP pc442.emulab.net.ssh > nat-128-62-164-12.public.utexas.edu.50001: Flags [P.], seq 1859963623:1859963811, ack 2810208685, win 63750, length 188
13:22:25.490757 IP nat-128-62-164-12.public.utexas.edu.50001 > pc442.emulab.net.ssh: Flags [.], ack 0, win 63892, length 0
13:22:25.500731 IP6 fe80::224:e8ff:fe79:265f > ip6-allrouters: ICMP6, router solicitation, length 16
13:22:25.537129 IP nat-128-62-164-12.public.utexas.edu.50001 > pc442.emulab.net.ssh: Flags [.], ack 188, win 65000, length 0
13:22:25.587312 ARP, Request who-has 155.98.36.0 tell control-router.emulab.net, length 46
13:22:25.839051 ARP, Request who-has dns.google tell cnuc-dentistry.emulab.net, length 46
13:22:26.350780 ARP, Request who-has boss.emulab.net tell cnuc-dentistry.emulab.net, length 46
13:22:26.373507 STP 802.1d, Config, Flags [none], bridge-id 8003.0c:85:25:25:94:00.8030, length 42
13:22:26.433808 STP 802.1s, Rapid STP, CIST Flags [Proposal, Learn, Forward, Agreement], length 102
13:22:26.456003 IP pc442.emulab.net.43023 > boss.emulab.net.domain: 22583+ [1au] PTR? 42.38.98.155.in-addr.arpa. (54)
13:22:26.456154 IP boss.emulab.net.domain > pc442.emulab.net.43023: 22583* 1/2/2 PTR pc442.emulab.net. (135)
13:22:26.458571 IP pc442.emulab.net.60103 > boss.emulab.net.domain: 60321+ [1au] PTR? 0.36.98.155.in-addr.arpa. (53)
13:22:26.458776 IP boss.emulab.net.domain > pc442.emulab.net.60103: 60321 NXDomain* 0/1/1 (121)
13:22:26.458943 IP pc442.emulab.net.60103 > boss.emulab.net.domain: 60321+ PTR? 0.36.98.155.in-addr.arpa. (42)
13:22:26.459150 IP boss.emulab.net.domain > pc442.emulab.net.60103: 60321 NXDomain* 0/1/0 (110)
13:22:26.459939 IP pc442.emulab.net.56040 > boss.emulab.net.domain: 24584+ [1au] PTR? 1.36.98.155.in-addr.arpa. (53)
13:22:26.460159 IP boss.emulab.net.domain > pc442.emulab.net.56040: 24584* 1/2/2 PTR control-router.emulab.net. (143)
13:22:26.461680 IP pc442.emulab.net.45309 > boss.emulab.net.domain: 33056+ [1au] PTR? 221.37.98.155.in-addr.arpa. (55)
13:22:26.461812 IP boss.emulab.net.domain > pc442.emulab.net.45309: 33056* 1/2/2 PTR cnuc-dentistry.emulab.net. (145)
13:22:26.462499 IP pc442.emulab.net.52511 > boss.emulab.net.domain: 24793+ [1au] PTR? 70.32.98.155.in-addr.arpa. (54)
13:22:26.462718 IP boss.emulab.net.domain > pc442.emulab.net.52511: 24793* 1/2/2 PTR boss.emulab.net. (134)
13:22:26.707586 IP pc510.emulab.net.1012 > pc442.emulab.net.nfs: Flags [.], ack 3473569403, win 592, options [nop,nop,TS val 1428342690 ecr 877551777], length 0
13:22:26.707587 IP pc510.emulab.net.1012 > pc442.emulab.net.nfs: Flags [P.], seq 1:153, ack 1, win 592, options [nop,nop,TS val 1428342690 ecr 877551777], length 152: NFS request xid 3169131983 148 getattr fh 0,2/53
13:22:26.707606 IP pc442.emulab.net.nfs > pc510.emulab.net.1012: Flags [.], ack 1, win 7603, options [nop,nop,TS val 877582497 ecr 1428281250], length 0
13:22:26.707690 IP pc442.emulab.net.nfs > pc510.emulab.net.1012: Flags [P.], seq 1:85, ack 153, win 7603, options [nop,nop,TS val 877582497 ecr 1428342690], length 84: NFS reply xid 3169131983 reply ok 80 getattr NON 1 ids 0/1451437413 sz 135873184
13:22:26.707841 IP pc510.emulab.net.1012 > pc442.emulab.net.nfs: Flags [.], ack 85, win 592, options [nop,nop,TS val 1428342690 ecr 877582497], length 0
13:22:26.758029 ARP, Request who-has 155.98.38.198 tell control-router.emulab.net, length 46
13:22:26.816260 ARP, Request who-has pc850.emulab.net tell control-router.emulab.net, length 46
13:22:26.862770 ARP, Request who-has dns.google tell cnuc-dentistry.emulab.net, length 46
13:22:27.137733 ARP, Request who-has 155.98.37.152 tell control-router.emulab.net, length 46
13:22:27.315900 IP6 fe80::1e69:7aff:fe60:52b5 > ip6-allrouters: ICMP6, router solicitation, length 16
13:22:27.374753 ARP, Request who-has boss.emulab.net tell cnuc-dentistry.emulab.net, length 46
13:22:27.446604 IP pc442.emulab.net.51304 > ops.emulab.net.16505: Flags [.], ack 3178790659, win 501, options [nop,nop,TS val 3457713681 ecr 3219818001], length 0
13:22:27.446753 IP ops.emulab.net.16505 > pc442.emulab.net.51304: Flags [.], ack 1, win 128, options [nop,nop,TS val 3219998225 ecr 3457623468], length 0
13:22:27.479198 IP pc442.emulab.net.33657 > boss.emulab.net.domain: 32928+ [1au] PTR? 110.38.98.155.in-addr.arpa. (55)
13:22:27.479422 IP boss.emulab.net.domain > pc442.emulab.net.33657: 32928* 1/2/2 PTR pc510.emulab.net. (136)
13:22:27.480359 IP pc442.emulab.net.59279 > boss.emulab.net.domain: 49284+ [1au] PTR? 198.38.98.155.in-addr.arpa. (55)
13:22:27.480506 IP boss.emulab.net.domain > pc442.emulab.net.59279: 49284 NXDomain* 0/1/1 (123)
13:22:27.480670 IP pc442.emulab.net.59279 > boss.emulab.net.domain: 49284+ PTR? 198.38.98.155.in-addr.arpa. (44)
13:22:27.480820 IP boss.emulab.net.domain > pc442.emulab.net.59279: 49284 NXDomain* 0/1/0 (112)
13:22:27.481612 IP pc442.emulab.net.41682 > boss.emulab.net.domain: 45403+ [1au] PTR? 150.36.98.155.in-addr.arpa. (55)
13:22:27.481821 IP boss.emulab.net.domain > pc442.emulab.net.41682: 45403* 1/2/2 PTR pc850.emulab.net. (136)
13:22:27.482524 IP pc442.emulab.net.42905 > boss.emulab.net.domain: 4638+ [1au] PTR? 152.37.98.155.in-addr.arpa. (55)
13:22:27.482734 IP boss.emulab.net.domain > pc442.emulab.net.42905: 4638 NXDomain* 0/1/1 (123)
13:22:27.482907 IP pc442.emulab.net.42905 > boss.emulab.net.domain: 4638+ PTR? 152.37.98.155.in-addr.arpa. (44)
13:22:27.483101 IP boss.emulab.net.domain > pc442.emulab.net.42905: 4638 NXDomain* 0/1/0 (112)
13:22:27.485407 IP pc442.emulab.net.41840 > boss.emulab.net.domain: 22036+ [1au] PTR? 74.33.98.155.in-addr.arpa. (54)
13:22:27.485575 IP boss.emulab.net.domain > pc442.emulab.net.41840: 22036* 1/2/2 PTR ops.emulab.net. (133)
13:22:27.644269 ARP, Request who-has 155.98.37.172 tell control-router.emulab.net, length 46
13:22:27.702303 ARP, Request who-has 155.98.36.209 tell control-router.emulab.net, length 46
13:22:27.733247 ARP, Request who-has 155.98.39.226 tell control-router.emulab.net, length 46
13:22:27.886766 ARP, Request who-has dns.google tell cnuc-dentistry.emulab.net, length 46
13:22:27.926925 IP 89.248.163.19.46659 > pc348.emulab.net.2082: Flags [S], seq 3574905880, win 1024, length 0
13:22:27.942900 ARP, Request who-has 155.98.37.57 tell control-router.emulab.net, length 46
13:22:28.153243 ARP, Request who-has cnode-moran.emulab.net tell control-router.emulab.net, length 46
13:22:28.153476 IP ec2-18-61-159-236.ap-south-2.compute.amazonaws.com > pc256.emulab.net: ICMP echo request, id 8, seq 22287, length 16
13:22:28.153701 IP ec2-18-61-159-236.ap-south-2.compute.amazonaws.com > pc551.emulab.net: ICMP echo request, id 8, seq 22284, length 16
13:22:28.268250 IP 57.128.69.19 > pc308.emulab.net: ICMP echo request, id 24573, seq 0, length 64
13:22:28.268355 IP 57.128.69.19 > pc308.emulab.net: ICMP echo request, id 24574, seq 0, length 64
13:22:28.313997 ARP, Request who-has 155.98.36.193 tell control-router.emulab.net, length 46
13:22:28.379236 STP 802.1d, Config, Flags [none], bridge-id 8003.0c:85:25:25:94:00.8030, length 42
13:22:28.409091 ARP, Request who-has 155.98.37.10 tell control-router.emulab.net, length 46
13:22:28.430819 ARP, Request who-has boss.emulab.net tell cnuc-dentistry.emulab.net, length 46
13:22:28.433787 STP 802.1s, Rapid STP, CIST Flags [Proposal, Learn, Forward, Agreement], length 102
13:22:28.467199 IP ec2-18-60-49-223.ap-south-2.compute.amazonaws.com > pc551.emulab.net: ICMP echo request, id 8, seq 22284, length 16
13:22:28.467459 IP ec2-18-60-49-223.ap-south-2.compute.amazonaws.com > pc256.emulab.net: ICMP echo request, id 8, seq 22287, length 16
13:22:28.489549 IP ec2-18-61-31-186.ap-south-2.compute.amazonaws.com > pc256.emulab.net: ICMP echo request, id 8, seq 22287, length 16
13:22:28.489549 IP ec2-18-61-31-186.ap-south-2.compute.amazonaws.com > pc551.emulab.net: ICMP echo request, id 8, seq 22284, length 16
13:22:28.503192 IP pc442.emulab.net.54706 > boss.emulab.net.domain: 44322+ [1au] PTR? 172.37.98.155.in-addr.arpa. (55)
13:22:28.503398 IP boss.emulab.net.domain > pc442.emulab.net.54706: 44322 NXDomain* 0/1/1 (123)
13:22:28.503576 IP pc442.emulab.net.54706 > boss.emulab.net.domain: 44322+ PTR? 172.37.98.155.in-addr.arpa. (44)
13:22:28.503803 IP boss.emulab.net.domain > pc442.emulab.net.54706: 44322 NXDomain* 0/1/0 (112)
13:22:28.504654 IP pc442.emulab.net.58237 > boss.emulab.net.domain: 62460+ [1au] PTR? 209.36.98.155.in-addr.arpa. (55)
13:22:28.504860 IP boss.emulab.net.domain > pc442.emulab.net.58237: 62460 NXDomain* 0/1/1 (123)
13:22:28.505020 IP pc442.emulab.net.58237 > boss.emulab.net.domain: 62460+ PTR? 209.36.98.155.in-addr.arpa. (44)
13:22:28.505231 IP boss.emulab.net.domain > pc442.emulab.net.58237: 62460 NXDomain* 0/1/0 (112)
13:22:28.505918 IP pc442.emulab.net.33018 > boss.emulab.net.domain: 29755+ [1au] PTR? 226.39.98.155.in-addr.arpa. (55)
13:22:28.506129 IP boss.emulab.net.domain > pc442.emulab.net.33018: 29755 NXDomain* 0/1/1 (123)
13:22:28.506256 IP pc442.emulab.net.33018 > boss.emulab.net.domain: 29755+ PTR? 226.39.98.155.in-addr.arpa. (44)
13:22:28.506403 IP boss.emulab.net.domain > pc442.emulab.net.33018: 29755 NXDomain* 0/1/0 (112)
13:22:28.507174 IP pc442.emulab.net.59185 > boss.emulab.net.domain: 19653+ [1au] PTR? 148.39.98.155.in-addr.arpa. (55)
13:22:28.507449 IP boss.emulab.net.domain > pc442.emulab.net.59185: 19653* 1/2/2 PTR pc348.emulab.net. (136)
13:22:28.508270 IP pc442.emulab.net.55881 > boss.emulab.net.domain: 56584+ [1au] PTR? 19.163.248.89.in-addr.arpa. (55)
13:22:28.508504 IP boss.emulab.net.domain > pc442.emulab.net.55881: 56584 NXDomain 0/1/1 (132)
13:22:28.508642 IP pc442.emulab.net.55881 > boss.emulab.net.domain: 56584+ PTR? 19.163.248.89.in-addr.arpa. (44)
13:22:28.508878 IP boss.emulab.net.domain > pc442.emulab.net.55881: 56584 NXDomain 0/1/0 (121)
13:22:28.509578 IP pc442.emulab.net.55157 > boss.emulab.net.domain: 62823+ [1au] PTR? 57.37.98.155.in-addr.arpa. (54)
13:22:28.509794 IP boss.emulab.net.domain > pc442.emulab.net.55157: 62823 NXDomain* 0/1/1 (122)
13:22:28.509915 IP pc442.emulab.net.55157 > boss.emulab.net.domain: 62823+ PTR? 57.37.98.155.in-addr.arpa. (43)
13:22:28.510123 IP boss.emulab.net.domain > pc442.emulab.net.55157: 62823 NXDomain* 0/1/0 (111)
13:22:28.510886 IP pc442.emulab.net.60950 > boss.emulab.net.domain: 27776+ [1au] PTR? 231.37.98.155.in-addr.arpa. (55)
13:22:28.511032 IP boss.emulab.net.domain > pc442.emulab.net.60950: 27776* 1/2/2 PTR cnode-moran.emulab.net. (142)
13:22:28.511840 IP pc442.emulab.net.37810 > boss.emulab.net.domain: 28500+ [1au] PTR? 56.39.98.155.in-addr.arpa. (54)
13:22:28.512049 IP boss.emulab.net.domain > pc442.emulab.net.37810: 28500* 1/2/2 PTR pc256.emulab.net. (135)
13:22:28.512769 IP pc442.emulab.net.52479 > boss.emulab.net.domain: 22502+ [1au] PTR? 236.159.61.18.in-addr.arpa. (55)
13:22:28.578930 IP boss.emulab.net.domain > pc442.emulab.net.52479: 22502 1/4/5 PTR ec2-18-61-159-236.ap-south-2.compute.amazonaws.com. (320)
13:22:28.580013 IP pc442.emulab.net.47956 > boss.emulab.net.domain: 46120+ [1au] PTR? 151.38.98.155.in-addr.arpa. (55)
13:22:28.580236 IP boss.emulab.net.domain > pc442.emulab.net.47956: 46120* 1/2/2 PTR pc551.emulab.net. (136)
13:22:28.581073 IP pc442.emulab.net.35313 > boss.emulab.net.domain: 22576+ [1au] PTR? 108.39.98.155.in-addr.arpa. (55)
13:22:28.581297 IP boss.emulab.net.domain > pc442.emulab.net.35313: 22576* 1/2/2 PTR pc308.emulab.net. (136)
13:22:28.582018 IP pc442.emulab.net.52883 > boss.emulab.net.domain: 58890+ [1au] PTR? 19.69.128.57.in-addr.arpa. (54)
13:22:28.588376 ARP, Request who-has 155.98.38.213 tell control-router.emulab.net, length 46
13:22:28.788104 ARP, Request who-has 155.98.37.156 tell control-router.emulab.net, length 46
13:22:28.830840 ARP, Request who-has 155.98.37.238 tell control-router.emulab.net, length 46
13:22:28.883821 IP boss.emulab.net.domain > pc442.emulab.net.52883: 58890 ServFail 0/0/1 (54)
13:22:28.883971 IP pc442.emulab.net.52883 > boss.emulab.net.domain: 58890+ [1au] PTR? 19.69.128.57.in-addr.arpa. (54)
13:22:28.884122 IP boss.emulab.net.domain > pc442.emulab.net.52883: 58890 ServFail 0/0/1 (54)
13:22:28.884269 IP pc442.emulab.net.52883 > boss.emulab.net.domain: 58890+ PTR? 19.69.128.57.in-addr.arpa. (43)
13:22:28.884425 IP boss.emulab.net.domain > pc442.emulab.net.52883: 58890 ServFail 0/0/0 (43)
13:22:28.885149 IP pc442.emulab.net.59451 > boss.emulab.net.domain: 42675+ [1au] PTR? 19.69.128.57.in-addr.arpa. (54)
13:22:28.885360 IP boss.emulab.net.domain > pc442.emulab.net.59451: 42675 ServFail 0/0/1 (54)
13:22:28.885490 IP pc442.emulab.net.59451 > boss.emulab.net.domain: 42675+ [1au] PTR? 19.69.128.57.in-addr.arpa. (54)
13:22:28.885680 IP boss.emulab.net.domain > pc442.emulab.net.59451: 42675 ServFail 0/0/1 (54)
13:22:28.885788 IP pc442.emulab.net.59451 > boss.emulab.net.domain: 42675+ PTR? 19.69.128.57.in-addr.arpa. (43)
13:22:28.885952 IP boss.emulab.net.domain > pc442.emulab.net.59451: 42675 ServFail 0/0/0 (43)
13:22:28.886599 IP pc442.emulab.net.34083 > boss.emulab.net.domain: 23208+ [1au] PTR? 193.36.98.155.in-addr.arpa. (55)
13:22:28.886747 IP boss.emulab.net.domain > pc442.emulab.net.34083: 23208 NXDomain* 0/1/1 (123)
13:22:28.886908 IP pc442.emulab.net.34083 > boss.emulab.net.domain: 23208+ PTR? 193.36.98.155.in-addr.arpa. (44)
13:22:28.887053 IP boss.emulab.net.domain > pc442.emulab.net.34083: 23208 NXDomain* 0/1/0 (112)
13:22:28.887902 IP pc442.emulab.net.52837 > boss.emulab.net.domain: 31148+ [1au] PTR? 10.37.98.155.in-addr.arpa. (54)
13:22:28.888122 IP boss.emulab.net.domain > pc442.emulab.net.52837: 31148 NXDomain* 0/1/1 (122)
13:22:28.888295 IP pc442.emulab.net.52837 > boss.emulab.net.domain: 31148+ PTR? 10.37.98.155.in-addr.arpa. (43)
13:22:28.888482 IP boss.emulab.net.domain > pc442.emulab.net.52837: 31148 NXDomain* 0/1/0 (111)
13:22:28.889241 IP pc442.emulab.net.50054 > boss.emulab.net.domain: 29999+ [1au] PTR? 223.49.60.18.in-addr.arpa. (54)
13:22:28.927082 IP boss.emulab.net.domain > pc442.emulab.net.50054: 29999 1/4/5 PTR ec2-18-60-49-223.ap-south-2.compute.amazonaws.com. (318)
13:22:28.928177 IP pc442.emulab.net.41399 > boss.emulab.net.domain: 35908+ [1au] PTR? 186.31.61.18.in-addr.arpa. (54)
13:22:28.942928 ARP, Request who-has dns.google tell cnuc-dentistry.emulab.net, length 46
13:22:28.948985 ARP, Request who-has 155.98.38.161 tell control-router.emulab.net, length 46
13:22:28.963814 IP boss.emulab.net.domain > pc442.emulab.net.41399: 35908 1/4/5 PTR ec2-18-61-31-186.ap-south-2.compute.amazonaws.com. (318)
13:22:28.993467 IP ams.server2.lib.com.51238 > pc464.emulab.net.openvpn: UDP, length 18
13:22:28.996757 IP 0.0.0.0.bootpc > 255.255.255.255.bootps: BOOTP/DHCP, Request from e4:11:5b:ea:e2:24 (oui Unknown), length 548
13:22:29.076108 ARP, Request who-has 155.98.36.222 tell control-router.emulab.net, length 46
13:22:29.088759 ARP, Request who-has pc333.emulab.net tell control-router.emulab.net, length 46
13:22:29.454751 ARP, Request who-has boss.emulab.net tell cnuc-dentistry.emulab.net, length 46
13:22:29.527477 IP pc442.emulab.net.54069 > boss.emulab.net.domain: 29311+ [1au] PTR? 213.38.98.155.in-addr.arpa. (55)
13:22:29.527651 IP boss.emulab.net.domain > pc442.emulab.net.54069: 29311 NXDomain* 0/1/1 (123)
13:22:29.527818 IP pc442.emulab.net.54069 > boss.emulab.net.domain: 29311+ PTR? 213.38.98.155.in-addr.arpa. (44)
13:22:29.527957 IP boss.emulab.net.domain > pc442.emulab.net.54069: 29311 NXDomain* 0/1/0 (112)
13:22:29.528810 IP pc442.emulab.net.45075 > boss.emulab.net.domain: 14411+ [1au] PTR? 156.37.98.155.in-addr.arpa. (55)
13:22:29.528956 IP boss.emulab.net.domain > pc442.emulab.net.45075: 14411 NXDomain* 0/1/1 (123)
13:22:29.529125 IP pc442.emulab.net.45075 > boss.emulab.net.domain: 14411+ PTR? 156.37.98.155.in-addr.arpa. (44)
13:22:29.529265 IP boss.emulab.net.domain > pc442.emulab.net.45075: 14411 NXDomain* 0/1/0 (112)
13:22:29.530063 IP pc442.emulab.net.54131 > boss.emulab.net.domain: 60741+ [1au] PTR? 238.37.98.155.in-addr.arpa. (55)
13:22:29.530244 IP boss.emulab.net.domain > pc442.emulab.net.54131: 60741 NXDomain* 0/1/1 (123)
13:22:29.530346 IP pc442.emulab.net.54131 > boss.emulab.net.domain: 60741+ PTR? 238.37.98.155.in-addr.arpa. (44)
13:22:29.530578 IP boss.emulab.net.domain > pc442.emulab.net.54131: 60741 NXDomain* 0/1/0 (112)
13:22:29.531745 IP pc442.emulab.net.34257 > boss.emulab.net.domain: 18000+ [1au] PTR? 161.38.98.155.in-addr.arpa. (55)
13:22:29.531951 IP boss.emulab.net.domain > pc442.emulab.net.34257: 18000 NXDomain* 0/1/1 (123)
13:22:29.532122 IP pc442.emulab.net.34257 > boss.emulab.net.domain: 18000+ PTR? 161.38.98.155.in-addr.arpa. (44)
13:22:29.532330 IP boss.emulab.net.domain > pc442.emulab.net.34257: 18000 NXDomain* 0/1/0 (112)
13:22:29.533104 IP pc442.emulab.net.35910 > boss.emulab.net.domain: 37896+ [1au] PTR? 64.38.98.155.in-addr.arpa. (54)
13:22:29.533314 IP boss.emulab.net.domain > pc442.emulab.net.35910: 37896* 1/2/2 PTR pc464.emulab.net. (135)
13:22:29.534024 IP pc442.emulab.net.55849 > boss.emulab.net.domain: 31831+ [1au] PTR? 86.101.20.198.in-addr.arpa. (55)
13:22:29.655183 ARP, Request who-has sm05.emulab.net tell control-router.emulab.net, length 46
13:22:29.766174 IP boss.emulab.net.domain > pc442.emulab.net.55849: 31831 1/3/3 PTR ams.server2.lib.com. (184)
13:22:29.767880 IP pc442.emulab.net.44398 > boss.emulab.net.domain: 56448+ [1au] PTR? 222.36.98.155.in-addr.arpa. (55)
13:22:29.768027 IP boss.emulab.net.domain > pc442.emulab.net.44398: 56448 NXDomain* 0/1/1 (123)
13:22:29.768192 IP pc442.emulab.net.44398 > boss.emulab.net.domain: 56448+ PTR? 222.36.98.155.in-addr.arpa. (44)
13:22:29.768343 IP boss.emulab.net.domain > pc442.emulab.net.44398: 56448 NXDomain* 0/1/0 (112)
13:22:29.769075 IP pc442.emulab.net.50369 > boss.emulab.net.domain: 13332+ [1au] PTR? 133.39.98.155.in-addr.arpa. (55)
13:22:29.769218 IP boss.emulab.net.domain > pc442.emulab.net.50369: 13332* 1/2/2 PTR pc333.emulab.net. (136)
13:22:29.911469 ARP, Request who-has 155.98.39.21 tell control-router.emulab.net, length 46
13:22:29.966747 ARP, Request who-has dns.google tell cnuc-dentistry.emulab.net, length 46
13:22:30.185432 IP 89.248.163.19.46659 > pc290.emulab.net.2082: Flags [S], seq 4091478409, win 1024, length 0
13:22:30.379424 STP 802.1d, Config, Flags [none], bridge-id 8003.0c:85:25:25:94:00.8030, length 42
13:22:30.433774 STP 802.1s, Rapid STP, CIST Flags [Proposal, Learn, Forward, Agreement], length 102
13:22:30.460959 ARP, Request who-has 155.98.39.210 tell control-router.emulab.net, length 46
13:22:30.478751 ARP, Request who-has boss.emulab.net tell cnuc-dentistry.emulab.net, length 46
13:22:30.551274 IP pc442.emulab.net.35343 > boss.emulab.net.domain: 60260+ [1au] PTR? 185.36.98.155.in-addr.arpa. (55)
13:22:30.551496 IP boss.emulab.net.domain > pc442.emulab.net.35343: 60260* 1/2/2 PTR sm05.emulab.net. (135)
13:22:30.552420 IP pc442.emulab.net.54194 > boss.emulab.net.domain: 34946+ [1au] PTR? 21.39.98.155.in-addr.arpa. (54)
13:22:30.552630 IP boss.emulab.net.domain > pc442.emulab.net.54194: 34946 NXDomain* 0/1/1 (122)
13:22:30.552801 IP pc442.emulab.net.54194 > boss.emulab.net.domain: 34946+ PTR? 21.39.98.155.in-addr.arpa. (43)
13:22:30.553029 IP boss.emulab.net.domain > pc442.emulab.net.54194: 34946 NXDomain* 0/1/0 (111)
13:22:30.553753 IP pc442.emulab.net.36575 > boss.emulab.net.domain: 667+ [1au] PTR? 90.39.98.155.in-addr.arpa. (54)
13:22:30.553988 IP boss.emulab.net.domain > pc442.emulab.net.36575: 667* 1/2/2 PTR pc290.emulab.net. (135)
13:22:30.554749 IP pc442.emulab.net.49583 > boss.emulab.net.domain: 56927+ [1au] PTR? 210.39.98.155.in-addr.arpa. (55)
13:22:30.554954 IP boss.emulab.net.domain > pc442.emulab.net.49583: 56927 NXDomain* 0/1/1 (123)
13:22:30.555122 IP pc442.emulab.net.49583 > boss.emulab.net.domain: 56927+ PTR? 210.39.98.155.in-addr.arpa. (44)
13:22:30.555329 IP boss.emulab.net.domain > pc442.emulab.net.49583: 56927 NXDomain* 0/1/0 (112)
13:22:30.990695 ARP, Request who-has dns.google tell cnuc-dentistry.emulab.net, length 46
13:22:31.502936 ARP, Request who-has boss.emulab.net tell cnuc-dentistry.emulab.net, length 46
13:22:31.602276 ARP, Request who-has cnode-ebc.emulab.net tell control-router.emulab.net, length 46
13:22:31.798540 ARP, Request who-has pc510.emulab.net tell pc442.emulab.net, length 28
13:22:31.798705 ARP, Reply pc510.emulab.net is-at 00:24:e8:78:37:7b (oui Unknown), length 46
13:22:31.827435 ARP, Request who-has pc442.emulab.net tell pc510.emulab.net, length 46
13:22:31.827447 ARP, Reply pc442.emulab.net is-at 00:24:e8:77:b5:51 (oui Unknown), length 28
13:22:31.858542 IP6 fe80::46a8:42ff:fe4b:cf12.dhcpv6-client > ff02::1:2.dhcpv6-server: dhcp6 inf-req
13:22:31.859879 ARP, Request who-has pc303.emulab.net tell control-router.emulab.net, length 46
13:22:32.014875 ARP, Request who-has dns.google tell cnuc-dentistry.emulab.net, length 46
13:22:32.029733 ARP, Request who-has 155.98.36.225 tell control-router.emulab.net, length 46
13:22:32.073735 ARP, Request who-has 155.98.37.75 tell control-router.emulab.net, length 46
13:22:32.087090 IP ec2-108-136-138-128.ap-southeast-3.compute.amazonaws.com > pc256.emulab.net: ICMP echo request, id 5, seq 20698, length 16
13:22:32.095943 IP ec2-43-218-116-18.ap-southeast-3.compute.amazonaws.com > pc256.emulab.net: ICMP echo request, id 5, seq 20698, length 16
13:22:32.102628 IP ec2-108-136-168-105.ap-southeast-3.compute.amazonaws.com > pc256.emulab.net: ICMP echo request, id 5, seq 20698, length 16
13:22:32.193706 IP ec2-108-137-12-113.ap-southeast-3.compute.amazonaws.com > pc256.emulab.net: ICMP echo request, id 5, seq 20698, length 16
13:22:32.198049 IP ec2-108-137-130-142.ap-southeast-3.compute.amazonaws.com > pc256.emulab.net: ICMP echo request, id 5, seq 20698, length 16
13:22:32.373583 IP ec2-108-136-57-195.ap-southeast-3.compute.amazonaws.com > pc256.emulab.net: ICMP echo request, id 5, seq 20698, length 16
13:22:32.382111 STP 802.1d, Config, Flags [none], bridge-id 8003.0c:85:25:25:94:00.8030, length 42
13:22:32.400393 ARP, Request who-has dyn-155-98-38-183.emulab.net tell control-router.emulab.net, length 46
13:22:32.433764 STP 802.1s, Rapid STP, CIST Flags [Proposal, Learn, Forward, Agreement], length 102
13:22:32.481932 ARP, Request who-has pc276.emulab.net tell control-router.emulab.net, length 46
13:22:32.526744 ARP, Request who-has boss.emulab.net tell cnuc-dentistry.emulab.net, length 46
13:22:32.531984 ARP, Request who-has 155.98.39.246 tell control-router.emulab.net, length 46
13:22:32.599030 IP pc442.emulab.net.53683 > boss.emulab.net.domain: 49791+ [1au] PTR? 233.37.98.155.in-addr.arpa. (55)
13:22:32.599284 IP boss.emulab.net.domain > pc442.emulab.net.53683: 49791* 1/2/2 PTR cnode-ebc.emulab.net. (140)
13:22:32.600666 IP pc442.emulab.net.40368 > boss.emulab.net.domain: 43089+ [1au] PTR? 2.0.0.0.1.0.0.0.0.0.0.0.0.0.0.0.0.0.0.0.0.0.0.0.0.0.0.0.2.0.f.f.ip6.arpa. (101)
13:22:32.600913 IP boss.emulab.net.domain > pc442.emulab.net.40368: 43089 NXDomain 0/1/1 (165)
13:22:32.601150 IP pc442.emulab.net.40368 > boss.emulab.net.domain: 43089+ PTR? 2.0.0.0.1.0.0.0.0.0.0.0.0.0.0.0.0.0.0.0.0.0.0.0.0.0.0.0.2.0.f.f.ip6.arpa. (90)
13:22:32.601300 IP boss.emulab.net.domain > pc442.emulab.net.40368: 43089 NXDomain 0/1/0 (154)
13:22:32.603922 IP pc442.emulab.net.56488 > boss.emulab.net.domain: 10279+ [1au] PTR? 103.39.98.155.in-addr.arpa. (55)
13:22:32.604127 IP boss.emulab.net.domain > pc442.emulab.net.56488: 10279* 1/2/2 PTR pc303.emulab.net. (136)
13:22:32.604918 IP pc442.emulab.net.36470 > boss.emulab.net.domain: 40640+ [1au] PTR? 225.36.98.155.in-addr.arpa. (55)
13:22:32.605155 IP boss.emulab.net.domain > pc442.emulab.net.36470: 40640 NXDomain* 0/1/1 (123)
13:22:32.605295 IP pc442.emulab.net.36470 > boss.emulab.net.domain: 40640+ PTR? 225.36.98.155.in-addr.arpa. (44)
13:22:32.605495 IP boss.emulab.net.domain > pc442.emulab.net.36470: 40640 NXDomain* 0/1/0 (112)
13:22:32.606167 IP pc442.emulab.net.51529 > boss.emulab.net.domain: 47548+ [1au] PTR? 75.37.98.155.in-addr.arpa. (54)
13:22:32.606299 IP boss.emulab.net.domain > pc442.emulab.net.51529: 47548 NXDomain* 0/1/1 (122)
13:22:32.606440 IP pc442.emulab.net.51529 > boss.emulab.net.domain: 47548+ PTR? 75.37.98.155.in-addr.arpa. (43)
13:22:32.606592 IP boss.emulab.net.domain > pc442.emulab.net.51529: 47548 NXDomain* 0/1/0 (111)
13:22:32.608991 IP pc442.emulab.net.60060 > boss.emulab.net.domain: 18621+ [1au] PTR? 105.168.136.108.in-addr.arpa. (57)
13:22:32.645551 IP 123.211.203.35.bc.googleusercontent.com.49185 > pc460.emulab.net.39802: Flags [S], seq 3312714709, win 1024, options [mss 1460], length 0
13:22:32.652424 ARP, Request who-has pc809.emulab.net tell control-router.emulab.net, length 46
13:22:32.661811 IP boss.emulab.net.domain > pc442.emulab.net.60060: 18621 1/4/5 PTR ec2-108-136-168-105.ap-southeast-3.compute.amazonaws.com. (344)
13:22:32.662970 IP pc442.emulab.net.56790 > boss.emulab.net.domain: 51798+ [1au] PTR? 113.12.137.108.in-addr.arpa. (56)
13:22:32.717690 IP boss.emulab.net.domain > pc442.emulab.net.56790: 51798 1/4/5 PTR ec2-108-137-12-113.ap-southeast-3.compute.amazonaws.com. (342)
13:22:32.718823 IP pc442.emulab.net.32909 > boss.emulab.net.domain: 22089+ [1au] PTR? 142.130.137.108.in-addr.arpa. (57)
13:22:32.721289 IP control-router.emulab.net > pim-routers.mcast.net: PIMv2, Hello, length 26
13:22:32.722928 IP control-router.emulab.net > all-systems.mcast.net: igmp query v2
13:22:32.754457 IP boss.emulab.net.domain > pc442.emulab.net.32909: 22089 1/4/5 PTR ec2-108-137-130-142.ap-southeast-3.compute.amazonaws.com. (344)
13:22:32.755578 IP pc442.emulab.net.55052 > boss.emulab.net.domain: 35296+ [1au] PTR? 195.57.136.108.in-addr.arpa. (56)
13:22:32.791150 IP boss.emulab.net.domain > pc442.emulab.net.55052: 35296 1/4/5 PTR ec2-108-136-57-195.ap-southeast-3.compute.amazonaws.com. (342)
13:22:32.792290 IP pc442.emulab.net.49449 > boss.emulab.net.domain: 45798+ [1au] PTR? 183.38.98.155.in-addr.arpa. (55)
13:22:32.792451 IP boss.emulab.net.domain > pc442.emulab.net.49449: 45798* 1/2/2 PTR dyn-155-98-38-183.emulab.net. (148)
13:22:32.793299 IP pc442.emulab.net.42257 > boss.emulab.net.domain: 27645+ [1au] PTR? 76.39.98.155.in-addr.arpa. (54)
13:22:32.793530 IP boss.emulab.net.domain > pc442.emulab.net.42257: 27645* 1/2/2 PTR pc276.emulab.net. (135)
13:22:32.794275 IP pc442.emulab.net.60592 > boss.emulab.net.domain: 48618+ [1au] PTR? 246.39.98.155.in-addr.arpa. (55)
13:22:32.794524 IP boss.emulab.net.domain > pc442.emulab.net.60592: 48618 NXDomain* 0/1/1 (123)
13:22:32.794675 IP pc442.emulab.net.60592 > boss.emulab.net.domain: 48618+ PTR? 246.39.98.155.in-addr.arpa. (44)
13:22:32.794886 IP boss.emulab.net.domain > pc442.emulab.net.60592: 48618 NXDomain* 0/1/0 (112)
13:22:32.904275 ARP, Request who-has ab.emulab.net tell control-router.emulab.net, length 46
13:22:32.912286 IP 2.56.165.89.42831 > pc255.emulab.net.ms-wbt-server: Flags [S], seq 1337983862, win 1024, length 0
13:22:32.918176 IP 2.56.165.89.42831 > pc323.emulab.net.ms-wbt-server: Flags [S], seq 2597334146, win 1024, length 0
13:22:33.038759 ARP, Request who-has dns.google tell cnuc-dentistry.emulab.net, length 46
13:22:33.437889 ARP, Request who-has pool-ctl-155-98-37-65.emulab.net tell control-router.emulab.net, length 46
13:22:33.450200 ARP, Request who-has 155.98.39.195 tell control-router.emulab.net, length 46
13:22:33.516455 ARP, Request who-has 155.98.37.150 tell control-router.emulab.net, length 46
13:22:33.538672 ARP, Request who-has 155.98.37.157 tell control-router.emulab.net, length 46
13:22:33.550652 ARP, Request who-has boss.emulab.net tell cnuc-dentistry.emulab.net, length 46
13:22:33.607422 ARP, Request who-has dyn-155-98-37-34.emulab.net tell control-router.emulab.net, length 46
13:22:33.623237 IP pc442.emulab.net.60450 > boss.emulab.net.domain: 58078+ [1au] PTR? 60.38.98.155.in-addr.arpa. (54)
13:22:33.623498 IP boss.emulab.net.domain > pc442.emulab.net.60450: 58078* 1/2/2 PTR pc460.emulab.net. (135)
13:22:33.624327 IP pc442.emulab.net.50155 > boss.emulab.net.domain: 62039+ [1au] PTR? 123.211.203.35.in-addr.arpa. (56)
13:22:33.640851 IP 89.248.163.16.46304 > pc403.emulab.net.1184: Flags [S], seq 3062745841, win 1024, length 0
13:22:33.665796 IP boss.emulab.net.domain > pc442.emulab.net.50155: 62039 1/4/9 PTR 123.211.203.35.bc.googleusercontent.com. (415)
13:22:33.666993 IP pc442.emulab.net.48849 > boss.emulab.net.domain: 23491+ [1au] PTR? 109.36.98.155.in-addr.arpa. (55)
13:22:33.667150 IP boss.emulab.net.domain > pc442.emulab.net.48849: 23491* 1/2/2 PTR pc809.emulab.net. (136)
13:22:33.669781 IP pc442.emulab.net.50853 > boss.emulab.net.domain: 37561+ [1au] PTR? 220.38.98.155.in-addr.arpa. (55)
13:22:33.670011 IP boss.emulab.net.domain > pc442.emulab.net.50853: 37561* 1/2/2 PTR ab.emulab.net. (133)
13:22:33.670660 IP pc442.emulab.net.55995 > boss.emulab.net.domain: 35686+ [1au] PTR? 55.39.98.155.in-addr.arpa. (54)
13:22:33.670833 IP boss.emulab.net.domain > pc442.emulab.net.55995: 35686* 1/2/2 PTR pc255.emulab.net. (135)
13:22:33.671654 IP pc442.emulab.net.33811 > boss.emulab.net.domain: 43575+ [1au] PTR? 89.165.56.2.in-addr.arpa. (53)
13:22:33.671878 IP boss.emulab.net.domain > pc442.emulab.net.33811: 43575 NXDomain 0/1/1 (117)
13:22:33.672054 IP pc442.emulab.net.33811 > boss.emulab.net.domain: 43575+ PTR? 89.165.56.2.in-addr.arpa. (42)
13:22:33.672255 IP boss.emulab.net.domain > pc442.emulab.net.33811: 43575 NXDomain 0/1/0 (106)
13:22:33.673008 IP pc442.emulab.net.39545 > boss.emulab.net.domain: 25687+ [1au] PTR? 123.39.98.155.in-addr.arpa. (55)
13:22:33.673201 IP boss.emulab.net.domain > pc442.emulab.net.39545: 25687* 1/2/2 PTR pc323.emulab.net. (136)
13:22:33.673899 IP pc442.emulab.net.45309 > boss.emulab.net.domain: 62391+ [1au] PTR? 65.37.98.155.in-addr.arpa. (54)
13:22:33.674034 IP boss.emulab.net.domain > pc442.emulab.net.45309: 62391* 1/2/2 PTR pool-ctl-155-98-37-65.emulab.net. (151)
13:22:33.674803 IP pc442.emulab.net.49987 > boss.emulab.net.domain: 28636+ [1au] PTR? 195.39.98.155.in-addr.arpa. (55)
13:22:33.675010 IP boss.emulab.net.domain > pc442.emulab.net.49987: 28636 NXDomain* 0/1/1 (123)
13:22:33.675115 IP pc442.emulab.net.49987 > boss.emulab.net.domain: 28636+ PTR? 195.39.98.155.in-addr.arpa. (44)
13:22:33.675324 IP boss.emulab.net.domain > pc442.emulab.net.49987: 28636 NXDomain* 0/1/0 (112)
13:22:33.676066 IP pc442.emulab.net.57917 > boss.emulab.net.domain: 24283+ [1au] PTR? 150.37.98.155.in-addr.arpa. (55)
13:22:33.676289 IP boss.emulab.net.domain > pc442.emulab.net.57917: 24283 NXDomain* 0/1/1 (123)
13:22:33.676422 IP pc442.emulab.net.57917 > boss.emulab.net.domain: 24283+ PTR? 150.37.98.155.in-addr.arpa. (44)
13:22:33.676635 IP boss.emulab.net.domain > pc442.emulab.net.57917: 24283 NXDomain* 0/1/0 (112)
13:22:33.677319 IP pc442.emulab.net.60664 > boss.emulab.net.domain: 3133+ [1au] PTR? 157.37.98.155.in-addr.arpa. (55)
13:22:33.677487 IP boss.emulab.net.domain > pc442.emulab.net.60664: 3133 NXDomain* 0/1/1 (123)
13:22:33.677612 IP pc442.emulab.net.60664 > boss.emulab.net.domain: 3133+ PTR? 157.37.98.155.in-addr.arpa. (44)
13:22:33.677777 IP boss.emulab.net.domain > pc442.emulab.net.60664: 3133 NXDomain* 0/1/0 (112)
13:22:33.678477 IP pc442.emulab.net.43294 > boss.emulab.net.domain: 37930+ [1au] PTR? 34.37.98.155.in-addr.arpa. (54)
13:22:33.678692 IP boss.emulab.net.domain > pc442.emulab.net.43294: 37930* 1/2/2 PTR dyn-155-98-37-34.emulab.net. (146)
13:22:34.062762 ARP, Request who-has dns.google tell cnuc-dentistry.emulab.net, length 46
13:22:34.228216 IP 43.131.52.47.16890 > pc551.emulab.net.51200: Flags [S], seq 2959663542, win 65535, options [mss 1424,nop,wscale 8,nop,nop,sackOK], length 0
13:22:34.254383 IP 0.0.0.0.bootpc > 255.255.255.255.bootps: BOOTP/DHCP, Request from 44:a8:42:4a:33:24 (oui Unknown), length 292
13:22:34.345888 ARP, Request who-has pc335.emulab.net tell control-router.emulab.net, length 46
13:22:34.406960 STP 802.1d, Config, Flags [none], bridge-id 8003.0c:85:25:25:94:00.8030, length 42
13:22:34.433763 STP 802.1s, Rapid STP, CIST Flags [Proposal, Learn, Forward, Agreement], length 102
13:22:34.445249 ARP, Request who-has 155.98.36.217 tell control-router.emulab.net, length 46
13:22:34.575029 ARP, Request who-has boss.emulab.net tell cnuc-dentistry.emulab.net, length 46
13:22:34.647138 IP pc442.emulab.net.42039 > boss.emulab.net.domain: 31085+ [1au] PTR? 3.38.98.155.in-addr.arpa. (53)
13:22:34.647371 IP boss.emulab.net.domain > pc442.emulab.net.42039: 31085* 1/2/2 PTR pc403.emulab.net. (134)
13:22:34.648210 IP pc442.emulab.net.42422 > boss.emulab.net.domain: 10752+ [1au] PTR? 16.163.248.89.in-addr.arpa. (55)
13:22:34.648423 IP boss.emulab.net.domain > pc442.emulab.net.42422: 10752 NXDomain 0/1/1 (132)
13:22:34.648595 IP pc442.emulab.net.42422 > boss.emulab.net.domain: 10752+ PTR? 16.163.248.89.in-addr.arpa. (44)
13:22:34.648803 IP boss.emulab.net.domain > pc442.emulab.net.42422: 10752 NXDomain 0/1/0 (121)
13:22:34.650030 IP pc442.emulab.net.44021 > boss.emulab.net.domain: 51323+ [1au] PTR? 47.52.131.43.in-addr.arpa. (54)
13:22:34.757355 ARP, Request who-has 155.98.37.129 tell control-router.emulab.net, length 46
13:22:34.768267 ARP, Request who-has pc316.emulab.net tell control-router.emulab.net, length 46
13:22:34.996196 IP boss.emulab.net.domain > pc442.emulab.net.44021: 51323 NXDomain 0/1/1 (142)
13:22:34.996364 IP pc442.emulab.net.44021 > boss.emulab.net.domain: 51323+ PTR? 47.52.131.43.in-addr.arpa. (43)
13:22:34.996512 IP boss.emulab.net.domain > pc442.emulab.net.44021: 51323 NXDomain 0/1/0 (131)
13:22:34.997411 IP pc442.emulab.net.41276 > boss.emulab.net.domain: 40969+ [1au] PTR? 135.39.98.155.in-addr.arpa. (55)
13:22:34.997641 IP boss.emulab.net.domain > pc442.emulab.net.41276: 40969* 1/2/2 PTR pc335.emulab.net. (136)
13:22:34.998410 IP pc442.emulab.net.36667 > boss.emulab.net.domain: 51110+ [1au] PTR? 217.36.98.155.in-addr.arpa. (55)
13:22:34.998625 IP boss.emulab.net.domain > pc442.emulab.net.36667: 51110 NXDomain* 0/1/1 (123)
13:22:34.998792 IP pc442.emulab.net.36667 > boss.emulab.net.domain: 51110+ PTR? 217.36.98.155.in-addr.arpa. (44)
13:22:34.999004 IP boss.emulab.net.domain > pc442.emulab.net.36667: 51110 NXDomain* 0/1/0 (112)
13:22:35.086881 ARP, Request who-has dns.google tell cnuc-dentistry.emulab.net, length 46
13:22:35.148879 IP 47.211.203.35.bc.googleusercontent.com.50443 > pc498.emulab.net.24462: Flags [S], seq 1259214927, win 1024, options [mss 1460], length 0
13:22:35.593798 ARP, Request who-has dyn-155-98-38-172.emulab.net tell control-router.emulab.net, length 46
13:22:35.598757 ARP, Request who-has boss.emulab.net tell cnuc-dentistry.emulab.net, length 46
13:22:35.598996 ARP, Request who-has pc809.emulab.net tell control-router.emulab.net, length 46
13:22:35.671136 IP pc442.emulab.net.42177 > boss.emulab.net.domain: 48599+ [1au] PTR? 129.37.98.155.in-addr.arpa. (55)
13:22:35.671289 IP boss.emulab.net.domain > pc442.emulab.net.42177: 48599 NXDomain* 0/1/1 (123)
13:22:35.671456 IP pc442.emulab.net.42177 > boss.emulab.net.domain: 48599+ PTR? 129.37.98.155.in-addr.arpa. (44)
13:22:35.671630 IP boss.emulab.net.domain > pc442.emulab.net.42177: 48599 NXDomain* 0/1/0 (112)
13:22:35.672482 IP pc442.emulab.net.35032 > boss.emulab.net.domain: 46986+ [1au] PTR? 116.39.98.155.in-addr.arpa. (55)
13:22:35.672702 IP boss.emulab.net.domain > pc442.emulab.net.35032: 46986* 1/2/2 PTR pc316.emulab.net. (136)
13:22:35.673636 IP pc442.emulab.net.35537 > boss.emulab.net.domain: 7667+ [1au] PTR? 98.38.98.155.in-addr.arpa. (54)
13:22:35.673829 IP boss.emulab.net.domain > pc442.emulab.net.35537: 7667* 1/2/2 PTR pc498.emulab.net. (135)
13:22:35.674561 IP pc442.emulab.net.40717 > boss.emulab.net.domain: 36881+ [1au] PTR? 47.211.203.35.in-addr.arpa. (55)
13:22:35.718241 IP boss.emulab.net.domain > pc442.emulab.net.40717: 36881 1/4/9 PTR 47.211.203.35.bc.googleusercontent.com. (413)
13:22:35.719394 IP pc442.emulab.net.53693 > boss.emulab.net.domain: 38771+ [1au] PTR? 172.38.98.155.in-addr.arpa. (55)
13:22:35.719621 IP boss.emulab.net.domain > pc442.emulab.net.53693: 38771* 1/2/2 PTR dyn-155-98-38-172.emulab.net. (148)
13:22:35.747313 IP 193.34.212.225.isakmp > pc227.emulab.net.isakmp: isakmp: parent_sa ikev2_init[I]
13:22:35.771552 ARP, Request who-has 155.98.37.109 tell control-router.emulab.net, length 46
13:22:35.803260 ARP, Request who-has pc222.emulab.net tell control-router.emulab.net, length 46
13:22:35.929882 IP 55.149.216.162.bc.googleusercontent.com.51756 > pc612.emulab.net.3974: Flags [S], seq 1869930309, win 1024, options [mss 1460], length 0
13:22:36.010067 ARP, Request who-has 155.98.37.250 tell control-router.emulab.net, length 46
13:22:36.040916 IP 89.248.163.16.46304 > pc406.emulab.net.1184: Flags [S], seq 2497512080, win 1024, length 0
13:22:36.110764 ARP, Request who-has dns.google tell cnuc-dentistry.emulab.net, length 46
13:22:36.236281 IP nat-128-62-164-12.public.utexas.edu.50272 > pc442.emulab.net.ssh: Flags [P.], seq 1634684042:1634684094, ack 2254067012, win 65000, length 52
13:22:36.236281 IP nat-128-62-164-12.public.utexas.edu.50272 > pc442.emulab.net.ssh: Flags [P.], seq 52:96, ack 1, win 65000, length 44
13:22:36.236400 IP pc442.emulab.net.ssh > nat-128-62-164-12.public.utexas.edu.50272: Flags [.], ack 96, win 63750, length 0
13:22:36.236898 IP nat-128-62-164-12.public.utexas.edu.50272 > pc442.emulab.net.ssh: Flags [P.], seq 96:140, ack 1, win 65000, length 44
13:22:36.237331 IP pc442.emulab.net.ssh > nat-128-62-164-12.public.utexas.edu.50272: Flags [P.], seq 1:61, ack 140, win 63750, length 60
13:22:36.332538 IP nat-128-62-164-12.public.utexas.edu.50272 > pc442.emulab.net.ssh: Flags [.], ack 61, win 64940, length 0
13:22:36.408638 STP 802.1d, Config, Flags [none], bridge-id 8003.0c:85:25:25:94:00.8030, length 42
13:22:36.433787 STP 802.1s, Rapid STP, CIST Flags [Proposal, Learn, Forward, Agreement], length 102
13:22:36.460501 ARP, Request who-has 155.98.37.181 tell control-router.emulab.net, length 46
13:22:36.547888 ARP, Request who-has nuc16.emulab.net tell control-router.emulab.net, length 46
13:22:36.622762 ARP, Request who-has boss.emulab.net tell cnuc-dentistry.emulab.net, length 46
13:22:36.695202 IP pc442.emulab.net.33691 > boss.emulab.net.domain: 56302+ [1au] PTR? 27.39.98.155.in-addr.arpa. (54)
13:22:36.695423 IP boss.emulab.net.domain > pc442.emulab.net.33691: 56302* 1/2/2 PTR pc227.emulab.net. (135)
13:22:36.696265 IP pc442.emulab.net.37955 > boss.emulab.net.domain: 37512+ [1au] PTR? 225.212.34.193.in-addr.arpa. (56)
13:22:36.696487 IP boss.emulab.net.domain > pc442.emulab.net.37955: 37512 NXDomain 0/1/1 (119)
13:22:36.696657 IP pc442.emulab.net.37955 > boss.emulab.net.domain: 37512+ PTR? 225.212.34.193.in-addr.arpa. (45)
13:22:36.696863 IP boss.emulab.net.domain > pc442.emulab.net.37955: 37512 NXDomain 0/1/0 (108)
13:22:36.697640 IP pc442.emulab.net.49854 > boss.emulab.net.domain: 34772+ [1au] PTR? 109.37.98.155.in-addr.arpa. (55)
13:22:36.697852 IP boss.emulab.net.domain > pc442.emulab.net.49854: 34772 NXDomain* 0/1/1 (123)
13:22:36.697992 IP pc442.emulab.net.49854 > boss.emulab.net.domain: 34772+ PTR? 109.37.98.155.in-addr.arpa. (44)
13:22:36.698187 IP boss.emulab.net.domain > pc442.emulab.net.49854: 34772 NXDomain* 0/1/0 (112)
13:22:36.698945 IP pc442.emulab.net.56106 > boss.emulab.net.domain: 18047+ [1au] PTR? 22.39.98.155.in-addr.arpa. (54)
13:22:36.699150 IP boss.emulab.net.domain > pc442.emulab.net.56106: 18047* 1/2/2 PTR pc222.emulab.net. (135)
13:22:36.699997 IP pc442.emulab.net.43107 > boss.emulab.net.domain: 8496+ [1au] PTR? 232.38.98.155.in-addr.arpa. (55)
13:22:36.700228 IP boss.emulab.net.domain > pc442.emulab.net.43107: 8496* 1/2/2 PTR pc612.emulab.net. (136)
13:22:36.700951 IP pc442.emulab.net.52448 > boss.emulab.net.domain: 64427+ [1au] PTR? 55.149.216.162.in-addr.arpa. (56)
13:22:36.715780 ARP, Request who-has pool-ctl-155-98-37-64.emulab.net tell control-router.emulab.net, length 46
13:22:36.746689 IP boss.emulab.net.domain > pc442.emulab.net.52448: 64427 1/4/9 PTR 55.149.216.162.bc.googleusercontent.com. (415)
13:22:36.747900 IP pc442.emulab.net.55993 > boss.emulab.net.domain: 55143+ [1au] PTR? 250.37.98.155.in-addr.arpa. (55)
